<?xml version="1.0" encoding="UTF-8"?>
<xs:schema elementFormDefault="qualified"
           xmlns:xs="http://www.w3.org/2001/XMLSchema"
           xmlns:job="http://job4j.ru"
           targetNamespace="http://job4j.ru">

    <xs:element name="entries">
        <xs:complexType>
            <xs:sequence>
                <xs:element name="entry" type="job:entryType" minOccurs="0" maxOccurs="unbounded"/>
            </xs:sequence>
        </xs:complexType>
    </xs:element>

    <xs:complexType name="entryType">
        <xs:sequence>
            <xs:element type="xs:int" name="field"/>
        </xs:sequence>
    </xs:complexType>

</xs:schema>
